title,location,price,bedroom,bathroom,area,year_contruction,maintenance,housing_type,operation_type,date_pub,url,price_clean,area_clean,bedroom_clean,bathroom_clean,district,security_score,safety_score,cost_score,services_score,final_score
Apartamento en alquiler en Ur. Punta Hermosa Sur,"Ur. Punta Hermosa Sur, Punta Hermosa, Lima, Lima ","USD10,000",5 dormitorios,5 baños,350 m²,2020.0,"S/.1,000",Apartamento,Alquiler,14 ene. 2023 - Publicado por PERU LUXURY PROPERTIES,https://www.properati.com.pe/detalle/14032-32-55da-346ff8ea3606-b40c96db-bb15-4c1e,37000.0,350.0,5,5,PUNTA HERMOSA,9.85,9.85,9.971428571428572,9.84,9.9
Apartamento en alquiler en Ur. La Planicie,"Ur. La Planicie, Punta Hermosa, Lima, Lima ","USD1,050",4 dormitorios,3 baños,124 m²,2013.0,,Apartamento,Alquiler,"Hace 3 semanas, 1 hora - Publicado por Remax Integrity",https://www.properati.com.pe/detalle/14032-32-6156-5459dc0f56bf-15ca7353-b85a-4894,3885.0,124.0,4,3,PUNTA HERMOSA,9.85,9.85,9.991532258064517,9.56,9.85
Casa en alquiler en Ur. Los Bungalows,"Ur. Los Bungalows, San Bartolo, Lima, Lima ","USD2,000",4 dormitorios,3 baños,360 m²,2007.0,,Casa,Alquiler,16 dic. 2022 - Publicado por Vania Rodríguez Bustamante,https://www.properati.com.pe/detalle/14032-32-57da-39aaf6640713-ae27c9a5-b1a5-41cd,7400.0,360.0,4,3,SAN BARTOLO,9.9,9.9,9.994444444444445,9.32,9.82
Casa de playa en alquiler en Hu. Rivera Norte,"Hu. Rivera Norte, San Bartolo, Lima, Lima ","USD5,500",7 dormitorios,5 baños,200 m²,2003.0,,Casa de playa,Alquiler,28 feb. 2023 - Publicado por LIMA CORRETAJE S.A.C,https://www.properati.com.pe/detalle/14032-32-8b71-27fc0d1436f-51e09056-8231-455d,20350.0,200.0,7,5,SAN BARTOLO,9.9,9.9,9.9725,9.16,9.78
Casa en alquiler en Ur. La Planicie,"Ur. La Planicie, Punta Hermosa, Lima, Lima ","USD2,000",4 dormitorios,4 baños,300 m²,2000.0,,Casa,Alquiler,27 feb. 2023 - Publicado por LIMA CORRETAJE S.A.C,https://www.properati.com.pe/detalle/14032-32-9ac3-986b39f1fb07-d95948a7-8e02-49f7,7400.0,300.0,4,4,PUNTA HERMOSA,9.85,9.85,9.993333333333332,9.04,9.75
Casa en alquiler en Ur. Punta Hermosa Sur,"Ur. Punta Hermosa Sur, Punta Hermosa, Lima, Lima ","USD7,000",4 dormitorios,4 baños,263 m²,2000.0,,Casa,Alquiler,20 dic. 2022 - Publicado por Century 21 Ambassador,https://www.properati.com.pe/detalle/14032-32-3488-30d3dcd17b8a-5d075364-871d-3520,25900.0,263.0,4,4,PUNTA HERMOSA,9.85,9.85,9.97338403041825,9.04,9.74
Apartamento en alquiler en Ur. Confraternidad,"Ur. Confraternidad, Barranco, Lima, Lima ","USD3,000",4 dormitorios,3 baños,280 m²,2016.0,S/.900,Apartamento,Alquiler,10 mar. 2023 - Publicado por Proyectum  Perú,https://www.properati.com.pe/detalle/14032-32-e2d2-6f44fa7e639-e220733d-834e-4cf2,11100.0,280.0,4,3,BARRANCO,9.17,9.17,9.989285714285714,9.68,9.6
Apartamento en alquiler en Sd. S/N,"Sd. S/N, Magdalena del Mar, Lima, Lima ",USD990,3 dormitorios,3 baños,106 m²,2022.0,S/.470,Apartamento,Alquiler,1 mar. 2023 - Publicado por Javier Sánchez Agente Inmobiliario,https://www.properati.com.pe/detalle/14032-32-6e07-f27f9f70a6ed-1eb11940-926c-40a6,3663.0,106.0,3,3,MAGDALENA DEL MAR,9.26,9.26,9.99066037735849,9.32,9.56
Apartamento en alquiler en Ur. San Gabriel,"Ur. San Gabriel, San Isidro, Lima, Lima ","USD9,999",4 dormitorios,4 baños,650 m²,2022.0,"S/.1,500",Apartamento,Alquiler,14 ene. 2023 - Publicado por PERU LUXURY PROPERTIES,https://www.properati.com.pe/detalle/14032-32-fdf0-d272ae4c8636-6a6db7c8-b377-41d1,36996.3,650.0,4,4,SAN ISIDRO,8.86,8.86,9.984616923076924,9.92,9.52
Apartamento en alquiler en Ur. Chacarilla Santa Cruz Zona Santa Isabel B,"Ur. Chacarilla Santa Cruz Zona Santa Isabel B, San Isidro, Lima, Lima ","USD1,500",3 dormitorios,4 baños,162 m²,2021.0,S/.1,Apartamento,Alquiler,"Hace 2 semanas, 5 días - Publicado por RE/MAX Principal pe",https://www.properati.com.pe/detalle/14032-32-a1c3-f7987295299e-d725da53-8601-4876,5550.0,162.0,3,4,SAN ISIDRO,8.86,8.86,9.99074074074074,9.879999999999999,9.52
Apartamento en alquiler en Ur. Aurora Este,"Ur. Aurora Este, Surquillo, Lima, Lima ","S/.3,300",4 dormitorios,3 baños,160 m²,2013.0,S/.300,Apartamento,Alquiler,"Hace 2 semanas, 2 días - Publicado por Piero ñopo Echevarría",https://www.properati.com.pe/detalle/14032-32-5850-34c14bf9f410-493c716b-8eb2-44eb,3300.0,160.0,4,3,SURQUILLO,8.9,8.9,9.994425675675675,9.56,9.47
Apartamento en alquiler en Ur. San Borja,"Ur. San Borja, San Borja, Lima, Lima ","USD2,500",4 dormitorios,4 baños,260 m²,2015.0,S/.600,Apartamento,Alquiler,"Hace 1 semana, 2 días - Publicado por Midori Kishimoto",https://www.properati.com.pe/detalle/14032-32-d913-94ae49df9d8a-30b10197-8a9b-498f,9250.0,260.0,4,4,SAN BORJA,8.86,8.86,9.990384615384615,9.64,9.47
Apartamento en alquiler en Ur. Campo De Polo,"Ur. Campo De Polo, Magdalena del Mar, Lima, Lima ","S/.3,900",3 dormitorios,3 baños,100 m²,2009.0,,Apartamento,Alquiler,28 ene. 2023 - Publicado por RE/MAX PERÚ,https://www.properati.com.pe/detalle/14032-32-af2e-1d4f69ddb2cd-b3db4a2e-974d-4540,3900.0,100.0,3,3,MAGDALENA DEL MAR,9.26,9.26,9.98945945945946,8.8,9.46
Apartamento en alquiler en Ur. Orrantia,"Ur. Orrantia, San Isidro, Lima, Lima ","USD1,150",3 dormitorios,4 baños,135 m²,2014.0,S/.520,Apartamento,Alquiler,25 feb. 2023 - Publicado por Lady Montes de Oca,https://www.properati.com.pe/detalle/14032-32-205b-cd0ee430d35d-3ba16fcb-b37a-458a,4255.0,135.0,3,4,SAN ISIDRO,8.86,8.86,9.99148148148148,9.6,9.46
Apartamento en alquiler en Ur. Mariscal Castilla,"Ur. Mariscal Castilla, San Borja, Lima, Lima ",USD800,3 dormitorios,4 baños,129 m²,2013.0,S/.300,Apartamento,Alquiler,"Hace 1 semana, 1 día - Publicado por REQUIEROMICASA ",https://www.properati.com.pe/detalle/14032-32-8af7-1cdb06d9c0f3-b3b3d36-af41-42b8,2960.0,129.0,3,4,SAN BORJA,8.86,8.86,9.993798449612402,9.56,9.45
Casa en alquiler en Co. La Molina Real,"Co. La Molina Real, La Molina, Lima, Lima ","USD2,200",5 dormitorios,5 baños,280 m²,2013.0,S/.600,Casa,Alquiler,16 mar. 2023 - Publicado por REMAX SPAZIO,https://www.properati.com.pe/detalle/14032-32-41c4-83677a5d1ce-d414da19-b116-4233,8140.0,280.0,5,5,LA MOLINA,8.83,8.83,9.992142857142857,9.56,9.44
Apartamento en alquiler en Ur. Limatambo,"Ur. Limatambo, San Isidro, Lima, Lima ","USD1,500",3 dormitorios,4 baños,200 m²,2011.0,S/.800,Apartamento,Alquiler,11 mar. 2023 - Publicado por Prime House,https://www.properati.com.pe/detalle/14032-32-8ede-2dc787348dec-f6829be-84fa-4516,5550.0,200.0,3,4,SAN ISIDRO,8.86,8.86,9.9925,9.48,9.44
Apartamento en alquiler en Ur. Oyague,"Ur. Oyague, Pueblo Libre, Lima, Lima ","S/.2,500",3 dormitorios,3 baños,150 m²,2012.0,S/.180,Apartamento,Alquiler,5 mar. 2023 - Publicado por RE/MAX Expo,https://www.properati.com.pe/detalle/14032-32-4a71-663fa8f57892-21a9862b-92fb-4f8d,2500.0,150.0,3,3,PUEBLO LIBRE,9.15,9.15,9.995495495495495,8.92,9.44
Casa en alquiler en Ur. Javier Prado (Cahuache),"Ur. Javier Prado (Cahuache), San Borja, Lima, Lima ","USD1,700",9 dormitorios,9 baños,200 m²,2012.0,,Casa,Alquiler,1 mar. 2023 - Publicado por RE/MAX Expo,https://www.properati.com.pe/detalle/14032-32-195a-5e02d83a21b-989fca48-9fa2-47d9,6290.0,200.0,9,9,SAN BORJA,8.86,8.86,9.9915,9.52,9.44
Apartamento en alquiler en Ur. El Palomar,"Ur. El Palomar, San Isidro, Lima, Lima ","USD1,200",4 dormitorios,4 baños,148 m²,2011.0,S/.500,Apartamento,Alquiler,9 feb. 2023 - Publicado por RE/MAX Expo,https://www.properati.com.pe/detalle/14032-32-b9f9-91e8667efcbd-1173703-b83e-43d9,4440.0,148.0,4,4,SAN ISIDRO,8.86,8.86,9.991891891891893,9.48,9.44
Apartamento en alquiler en Ur. Jardin,"Ur. Jardin, San Isidro, Lima, Lima ","USD1,200",4 dormitorios,3 baños,156 m²,2011.0,S/.450,Apartamento,Alquiler,1 mar. 2023 - Publicado por Lien Hub Inmobiliario,https://www.properati.com.pe/detalle/14032-32-fd2b-fa8e8374ef47-a9b776e9-aff2-4ab4,4440.0,156.0,4,3,SAN ISIDRO,8.86,8.86,9.992307692307692,9.48,9.44
Apartamento en alquiler en Ur. Santa Rosa,"Ur. Santa Rosa, San Isidro, Lima, Lima ","USD2,600",3 dormitorios,4 baños,244 m²,2012.0,S/.960,Apartamento,Alquiler,13 feb. 2023 - Publicado por Rocío Mazzetti,https://www.properati.com.pe/detalle/14032-32-8038-8db6ab952c33-a858f17c-a07a-4b36,9620.0,244.0,3,4,SAN ISIDRO,8.86,8.86,9.989344262295083,9.52,9.44
Apartamento en alquiler en Ur. Chacarilla Del Estanque,"Ur. Chacarilla Del Estanque, San Borja, Lima, Lima ","USD2,800",3 dormitorios,4 baños,383 m²,2010.0,"S/.1,200",Apartamento,Alquiler,12 ene. 2023 - Publicado por NG Inmobiliaria,https://www.properati.com.pe/detalle/14032-32-2ddc-2d8fbfc13b92-412dab8b-b7ef-479b,10360.0,383.0,3,4,SAN BORJA,8.86,8.86,9.992689295039165,9.44,9.43
Apartamento en alquiler en Ur. Confraternidad,"Ur. Confraternidad, Barranco, Lima, Lima ","USD1,200",3 dormitorios,3 baños,110 m²,2010.0,S/.380,Apartamento,Alquiler,26 dic. 2022 - Publicado por Agentes Asociados,https://www.properati.com.pe/detalle/14032-32-1250-4ee6de009722-f8af4558-a625-44e6,4440.0,110.0,3,3,BARRANCO,9.17,9.17,9.989090909090908,8.84,9.43
Casa de playa en alquiler en Ur. Punta Negra,"Ur. Punta Negra, Punta Negra, Lima, Lima ",USD800,3 dormitorios,2 baños,120 m²,1993.0,,Casa de playa,Alquiler,12 feb. 2023 - Publicado por RTA TECHNICONCEPT,https://www.properati.com.pe/detalle/14032-32-e704-c9ad113a8900-6d677976-a60e-4667,2960.0,120.0,3,2,PUNTA NEGRA,9.93,9.93,9.993333333333332,7.26,9.42
Apartamento en alquiler en Ur. Monterrico Norte,"Ur. Monterrico Norte, San Borja, Lima, Lima ","USD1,150",3 dormitorios,3 baños,139 m²,2022.0,S/.500,Apartamento,Alquiler,25 mar. 2023 - Publicado por Tasso Inmobiliaria,https://www.properati.com.pe/detalle/14032-32-de63-da2e8f822c52-c0aa7dd-9b21-4493,4255.0,139.0,3,3,SAN BORJA,8.86,8.86,9.991726618705036,9.32,9.4
Apartamento en alquiler en Ur. Chacarilla Del Estanque,"Ur. Chacarilla Del Estanque, San Borja, Lima, Lima ","USD1,500",3 dormitorios,3 baños,150 m²,2022.0,S/.700,Apartamento,Alquiler,9 mar. 2023 - Publicado por RE/MAX Expo,https://www.properati.com.pe/detalle/14032-32-d9b7-2cf8649679c1-18551c74-a815-4a3c,5550.0,150.0,3,3,SAN BORJA,8.86,8.86,9.99,9.32,9.4
Apartamento en alquiler en Ur. San Borja,"Ur. San Borja, San Borja, Lima, Lima ","S/.3,400",3 dormitorios,3 baños,91 m²,2022.0,S/.240,Apartamento,Alquiler,17 nov. 2022 - Publicado por Alfredo Maccera,https://www.properati.com.pe/detalle/14032-32-662b-5b1103224919-d6de7530-c006-120d,3400.0,91.0,3,3,SAN BORJA,8.86,8.86,9.989901989901991,9.32,9.4
Apartamento en alquiler en Ur. Santa Monica,"Ur. Santa Monica, San Isidro, Lima, Lima ","USD3,500",3 dormitorios,3 baños,320 m²,2020.0,"S/.1,200",Apartamento,Alquiler,7 nov. 2022 - Publicado por 2g Agentes Inmobiliarios,https://www.properati.com.pe/detalle/14032-32-11a4-d426ee3fbada-1f0153c1-ada5-3fcb,12950.0,320.0,3,3,SAN ISIDRO,8.86,8.86,9.9890625,9.239999999999998,9.39
Casa en alquiler en Ur. El Sol De La Molina Etapa I,"Ur. El Sol De La Molina Etapa I, La Molina, Lima, Lima ","USD2,200",4 dormitorios,3 baños,330 m²,2006.0,S/.600,Casa,Alquiler,6 mar. 2023 - Publicado por RE/MAX Expo,https://www.properati.com.pe/detalle/14032-32-7c27-9aef3ad01741-55e52c06-a397-4aca,8140.0,330.0,4,3,LA MOLINA,8.83,8.83,9.993333333333332,9.280000000000001,9.39
Casa en alquiler en Ur. El Sol De La Molina Etapa I,"Ur. El Sol De La Molina Etapa I, La Molina, Lima, Lima ","USD2,300",4 dormitorios,3 baños,330 m²,2006.0,S/.600,Casa,Alquiler,6 mar. 2023 - Publicado por RE/MAX Expo,https://www.properati.com.pe/detalle/14032-32-448b-c8a06f851ae-acb12818-bb46-4c4f,8510.0,330.0,4,3,LA MOLINA,8.83,8.83,9.993030303030302,9.280000000000001,9.39
Apartamento en alquiler en Ah. Moron,"Ah. Moron, Chaclacayo, Lima, Lima ",USD370,3 dormitorios,2 baños,85 m²,2011.0,,Apartamento,Alquiler,"Hace 2 semanas, 4 días - Publicado por Remax Diamond",https://www.properati.com.pe/detalle/14032-32-bf6-4f67af066e6e-38077caa-bf4e-4ed5,1369.0,85.0,3,2,CHACLACAYO,9.48,9.48,9.995647058823529,7.98,9.39
Casa en alquiler en Ur. El Sol De La Molina Etapa I,"Ur. El Sol De La Molina Etapa I, La Molina, Lima, Lima ","USD2,100",4 dormitorios,3 baños,300 m²,2006.0,S/.600,Casa,Alquiler,5 mar. 2023 - Publicado por RE/MAX Expo,https://www.properati.com.pe/detalle/14032-32-c949-d3d9505eef72-a80394cd-b458-4587,7770.0,300.0,4,3,LA MOLINA,8.83,8.83,9.993,9.280000000000001,9.39
Apartamento en alquiler en Ur. Las Magnolias,"Ur. Las Magnolias, San Borja, Lima, Lima ",USD990,3 dormitorios,4 baños,220 m²,2004.0,S/.200,Apartamento,Alquiler,29 nov. 2022 - Publicado por DCITY Inmobiliaria   -  Denisse Soto & Asociados,https://www.properati.com.pe/detalle/14032-32-3be5-dc7126f4147b-2abb4f27-b4dc-40bb,3663.0,220.0,3,4,SAN BORJA,8.86,8.86,9.9955,9.2,9.38
Casa en alquiler en Ur. Los Halcones,"Ur. Los Halcones, Chaclacayo, Lima, Lima ","USD1,800",3 dormitorios,3 baños,624 m²,1988.0,S/.1,Casa,Alquiler,"Hace 5 días, 19 horas - Publicado por RE/MAX Lider-Luis Lancho Navas",https://www.properati.com.pe/detalle/14032-32-d3d9-cb66a168a494-76986cc-a2b3-40f9,6660.0,624.0,3,3,CHACLACAYO,9.48,9.48,9.997115384615384,7.96,9.38
Apartamento en alquiler en Ur. Chacarilla Santa Cruz,"Ur. Chacarilla Santa Cruz, San Isidro, Lima, Lima ","USD2,800",3 dormitorios,3 baños,240 m²,2019.0,"S/.1,900",Apartamento,Alquiler,"Hace 1 semana, 20 horas - Publicado por Büro Propiedades",https://www.properati.com.pe/detalle/14032-32-daf7-a61ccfc9fddd-bbd3af13-a20f-4159,10360.0,240.0,3,3,SAN ISIDRO,8.86,8.86,9.988333333333333,9.2,9.38
Apartamento en alquiler en Ur. Country Club,"Ur. Country Club, San Isidro, Lima, Lima ","USD2,600",3 dormitorios,3 baños,202 m²,2018.0,S/.650,Apartamento,Alquiler,"Hace 1 semana, 2 días - Publicado por Midori Kishimoto",https://www.properati.com.pe/detalle/14032-32-5fba-1ed6e7cb31f5-4c9a32a1-9c51-4215,9620.0,202.0,3,3,SAN ISIDRO,8.86,8.86,9.987128712871288,9.16,9.37
Apartamento en alquiler en Ur. Chacarilla Santa Cruz Zona Santa Isabel,"Ur. Chacarilla Santa Cruz Zona Santa Isabel, San Isidro, Lima, Lima ","USD1,500",3 dormitorios,3 baños,120 m²,2017.0,,Apartamento,Alquiler,28 feb. 2023 - Publicado por J&P Boutique Inmobiliaria Perú,https://www.properati.com.pe/detalle/14032-32-168a-e9b070553ad4-2ff1474c-8321-424a,5550.0,120.0,3,3,SAN ISIDRO,8.86,8.86,9.9875,9.12,9.36
Apartamento en alquiler en Ur. Oyague,"Ur. Oyague, Magdalena del Mar, Lima, Lima ",USD850,3 dormitorios,2 baños,76 m²,2019.0,S/.1,Apartamento,Alquiler,10 ene. 2023 - Publicado por Habitar,https://www.properati.com.pe/detalle/14032-32-5371-c8a8421cb383-68c9bee-a69f-4566,3145.0,76.0,3,2,MAGDALENA DEL MAR,9.26,9.26,9.988815789473684,8.3,9.36
Apartamento en alquiler en Ur. La Viñita,"Ur. La Viñita, Barranco, Lima, Lima ","USD1,000",3 dormitorios,2 baños,72 m²,2022.0,S/.50,Apartamento,Alquiler,11 mar. 2023 - Publicado por GABRIEL PAREJA Agente Inmobiliario,https://www.properati.com.pe/detalle/14032-32-c085-3bebdd2ffe8f-65afbfe0-a99f-120d,3700.0,72.0,3,2,BARRANCO,9.17,9.17,9.98611111111111,8.42,9.35
Apartamento en alquiler en Ur. Risso,"Ur. Risso, San Isidro, Lima, Lima ","S/.3,000",3 dormitorios,3 baños,99 m²,2015.0,S/.400,Apartamento,Alquiler,"Hace 2 semanas, 6 días - Publicado por LOGRA Inmobiliaria",https://www.properati.com.pe/detalle/14032-32-f36c-c7d962cf0c38-c5de7593-a00e-496a,3000.0,99.0,3,3,SAN ISIDRO,8.86,8.86,9.991809991809992,9.04,9.35
Casa en alquiler en Ur. Las Magnolias,"Ur. Las Magnolias, San Borja, Lima, Lima ","USD2,500",9 dormitorios,7 baños,416 m²,2000.0,,Casa,Alquiler,10 dic. 2022 - Publicado por Century 21 CTR,https://www.properati.com.pe/detalle/14032-32-6af0-e506e174bb10-d1c7a548-b416-39f6,9250.0,416.0,9,7,SAN BORJA,8.86,8.86,9.993990384615385,9.04,9.35
Casa en alquiler en Ur. Country Club,"Ur. Country Club, San Isidro, Lima, Lima ","USD1,900",5 dormitorios,5 baños,186 m²,2000.0,,Casa,Alquiler,21 feb. 2023 - Publicado por REMAX UNITED,https://www.properati.com.pe/detalle/14032-32-8be4-cfcff68ca856-51bb9f0f-a408-4687,7030.0,186.0,5,5,SAN ISIDRO,8.86,8.86,9.98978494623656,9.04,9.35
Apartamento en alquiler en Ur. Santa Rosa,"Ur. Santa Rosa, San Isidro, Lima, Lima ","USD3,500",4 dormitorios,5 baños,504 m²,2000.0,"S/.1,900",Apartamento,Alquiler,24 mar. 2023 - Publicado por Rocío Mazzetti,https://www.properati.com.pe/detalle/14032-32-3e0-f282faf7e3e6-a827f502-a0bc-47ed,12950.0,504.0,4,5,SAN ISIDRO,8.86,8.86,9.993055555555555,9.04,9.35
Casa en alquiler en Ur. Orrantia Del Mar Zona Iv,"Ur. Orrantia Del Mar Zona Iv, San Isidro, Lima, Lima ","USD2,000",3 dormitorios,5 baños,313 m²,2000.0,,Casa,Alquiler,2 dic. 2022 - Publicado por Madeleine Beltran,https://www.properati.com.pe/detalle/14032-32-d9d9-d1070f73140b-2d956fb8-9fb5-4258,7400.0,313.0,3,5,SAN ISIDRO,8.86,8.86,9.993610223642172,9.04,9.35
Casa en alquiler en Ur. El Sol De La Molina Etapa Iii,"Ur. El Sol De La Molina Etapa Iii, La Molina, Lima, Lima ","USD2,500",4 dormitorios,4 baños,258 m²,2001.0,,Casa,Alquiler,14 ene. 2023 - Publicado por Ventas Primeras Bienes Raices,https://www.properati.com.pe/detalle/14032-32-f90a-32d7c1aec14-4a0d4104-ac66-46b4,9250.0,258.0,4,4,LA MOLINA,8.83,8.83,9.99031007751938,9.08,9.34
Casa en alquiler en Ur. San Miguel,"Ur. San Miguel, San Miguel, Lima, Lima ","S/.4,400",4 dormitorios,3 baños,160 m²,2007.0,S/.10,Casa,Alquiler,19 dic. 2022 - Publicado por joresco real estate,https://www.properati.com.pe/detalle/14032-32-8017-27092107870f-83e25030-8dc3-120d,4400.0,160.0,4,3,SAN MIGUEL,8.7,8.7,9.992567567567567,9.32,9.34
Apartamento en alquiler en Ur. Country Club,"Ur. Country Club, San Isidro, Lima, Lima ","USD1,700",3 dormitorios,3 baños,160 m²,2014.0,S/.850,Apartamento,Alquiler,22 mar. 2023 - Publicado por Rocío Mazzetti,https://www.properati.com.pe/detalle/14032-32-4e2c-857814eee6df-7636074d-a6c9-4c25,6290.0,160.0,3,3,SAN ISIDRO,8.86,8.86,9.989375,9.0,9.34
Apartamento en alquiler en Ur. Santa Ines,"Ur. Santa Ines, San Isidro, Lima, Lima ","USD1,500",3 dormitorios,3 baños,175 m²,2014.0,S/.650,Apartamento,Alquiler,"Hace 2 semanas, 3 días - Publicado por JORGE ERNESTO SALAS GONZALES",https://www.properati.com.pe/detalle/14032-32-b545-bde684e638e9-6c4ce74a-a458-4739,5550.0,175.0,3,3,SAN ISIDRO,8.86,8.86,9.991428571428571,9.0,9.34
Apartamento en alquiler en Ur. Chacarilla Del Estanque,"Ur. Chacarilla Del Estanque, San Borja, Lima, Lima ","USD1,500",3 dormitorios,3 baños,140 m²,2014.0,,Apartamento,Alquiler,20 mar. 2023 - Publicado por Remax Integrity,https://www.properati.com.pe/detalle/14032-32-290f-6b616d72b45f-c144a006-be81-4440,5550.0,140.0,3,3,SAN BORJA,8.86,8.86,9.989285714285714,9.0,9.34
Apartamento en alquiler en Ur. Orrantia,"Ur. Orrantia, San Isidro, Lima, Lima ","USD1,150",3 dormitorios,3 baños,150 m²,2014.0,S/.550,Apartamento,Alquiler,27 feb. 2023 - Publicado por CARLA EMPERATRIZ NEIRA SILVA,https://www.properati.com.pe/detalle/14032-32-461c-73902c68c930-8798efc6-a195-4eba,4255.0,150.0,3,3,SAN ISIDRO,8.86,8.86,9.992333333333333,9.0,9.34
Apartamento en alquiler en Ur. Campo De Polo,"Ur. Campo De Polo, San Isidro, Lima, Lima ","USD1,400",3 dormitorios,3 baños,176 m²,2014.0,"S/.1,360",Apartamento,Alquiler,16 nov. 2022 - Publicado por ANA MARIA CECILIA ARTEAGA RODRIGUEZ,https://www.properati.com.pe/detalle/14032-32-67e-7961ec75091a-4f396479-8531-46a1,5180.0,176.0,3,3,SAN ISIDRO,8.86,8.86,9.992045454545455,9.0,9.34
Casa en alquiler en Ur. Rinconada Del Lago Etapa Ii,"Ur. Rinconada Del Lago Etapa Ii, La Molina, Lima, Lima ","USD3,000",4 dormitorios,5 baños,650 m²,2000.0,,Casa,Alquiler,24 mar. 2023 - Publicado por ISMAEL RIVAS OTERO,https://www.properati.com.pe/detalle/14032-32-54a8-5c778da00117-93355314-b152-4568,11100.0,650.0,4,5,LA MOLINA,8.83,8.83,9.995384615384616,9.04,9.34
Apartamento en alquiler en Ur. Orrantia,"Ur. Orrantia, San Isidro, Lima, Lima ","USD1,200",3 dormitorios,3 baños,160 m²,2012.0,S/.580,Apartamento,Alquiler,2 ene. 2023 - Publicado por Oscar Leandro Peña Villanueva,https://www.properati.com.pe/detalle/14032-32-923d-839d0497658d-6bf06a1e-9ecd-4a74,4440.0,160.0,3,3,SAN ISIDRO,8.86,8.86,9.9925,8.92,9.33
Apartamento en alquiler en Ur. Confraternidad,"Ur. Confraternidad, Barranco, Lima, Lima ",USD980,3 dormitorios,2 baños,96 m²,2020.0,S/.360,Apartamento,Alquiler,"Hace 4 días, 17 horas - Publicado por Remax Concept",https://www.properati.com.pe/detalle/14032-32-6cf9-310b98421e59-547f52f5-8e38-44aa,3626.0,96.0,3,2,BARRANCO,9.17,9.17,9.989791666666667,8.34,9.33
Apartamento en alquiler en Ur. Monterrico Norte,"Ur. Monterrico Norte, San Borja, Lima, Lima ","USD1,150",5 dormitorios,3 baños,232 m²,1998.0,S/.300,Apartamento,Alquiler,21 feb. 2023 - Publicado por CENTURY 21 AVANZA,https://www.properati.com.pe/detalle/14032-32-bb0-83c8bd20077a-97f9a96-8602-49e4,4255.0,232.0,5,3,SAN BORJA,8.86,8.86,9.995043103448275,8.96,9.33
Apartamento en alquiler en Ur. La Capilla (U-3),"Ur. La Capilla (U-3), La Molina, Lima, Lima ",USD850,4 dormitorios,4 baños,164 m²,1999.0,,Apartamento,Alquiler,20 feb. 2023 - Publicado por RE/MAX PERÚ,https://www.properati.com.pe/detalle/14032-32-8aed-86338fe224e1-1cbf6b5f-b767-429f,3145.0,164.0,4,4,LA MOLINA,8.83,8.83,9.994817073170733,9.0,9.33
Apartamento en alquiler en Ur. Jardin,"Ur. Jardin, San Isidro, Lima, Lima ","USD1,150",3 dormitorios,3 baños,136 m²,2012.0,S/.500,Apartamento,Alquiler,19 ene. 2023 - Publicado por Corretajes Inmobiliarios Matessa SAC,https://www.properati.com.pe/detalle/14032-32-6a4a-db1692748e5c-e2b8cd10-865f-4166,4255.0,136.0,3,3,SAN ISIDRO,8.86,8.86,9.99154411764706,8.92,9.32
Apartamento en alquiler en Ur. Jardin,"Ur. Jardin, San Isidro, Lima, Lima ","USD1,150",3 dormitorios,3 baños,136 m²,2012.0,S/.500,Apartamento,Alquiler,15 nov. 2022 - Publicado por Corretajes Inmobiliarios Matessa SAC,https://www.properati.com.pe/detalle/14032-32-f882-5a9e2053539c-6d4c4fca-8f1c-458a,4255.0,136.0,3,3,SAN ISIDRO,8.86,8.86,9.99154411764706,8.92,9.32
Apartamento en alquiler en Ur. Miramar,"Ur. Miramar, San Miguel, Lima, Lima ","USD1,000",3 dormitorios,3 baños,125 m²,2019.0,S/.450,Apartamento,Alquiler,10 feb. 2023 - Publicado por Marcia Rodriguez,https://www.properati.com.pe/detalle/14032-32-b3f7-675b2c763b9c-54315af8-bbf7-4a61,3700.0,125.0,3,3,SAN MIGUEL,8.7,8.7,9.991999999999999,9.2,9.32
Casa en alquiler en Ur. Rinconada Del Lago Etapa Ii,"Ur. Rinconada Del Lago Etapa Ii, La Molina, Lima, Lima ","S/.10,528",8 dormitorios,4 baños,369 m²,1997.0,,Casa,Alquiler,"Hace 1 semana, 17 horas - Publicado por RE/MAX PERÚ",https://www.properati.com.pe/detalle/14032-32-bfc6-5b3df02cb5a7-78d12914-8d1d-4f96,10528.0,369.0,8,4,LA MOLINA,8.83,8.83,9.992288874240094,8.92,9.31
Casa en alquiler en Ur. Santo Tomas,"Ur. Santo Tomas, San Borja, Lima, Lima ","USD1,800",3 dormitorios,4 baños,300 m²,1995.0,,Casa,Alquiler,10 feb. 2023 - Publicado por SOCIOS INMOBILIARIOS,https://www.properati.com.pe/detalle/14032-32-65a3-e6fd33dd01bc-30df33c1-af01-479e,6660.0,300.0,3,4,SAN BORJA,8.86,8.86,9.994,8.84,9.31
Apartamento en alquiler en Ur. Colmenares,"Ur. Colmenares, Pueblo Libre, Lima, Lima ",USD760,3 dormitorios,2 baños,104 m²,2017.0,S/.270,Apartamento,Alquiler,"Hace 4 días, 22 horas - Publicado por LIMA CORRETAJE S.A.C",https://www.properati.com.pe/detalle/14032-32-baee-68901d85bce1-4ad731e0-ab48-45de,2812.0,104.0,3,2,PUEBLO LIBRE,9.15,9.15,9.992692307692309,8.219999999999999,9.3
Casa en alquiler en Ur. 28 De Julio,"Ur. 28 De Julio, Pueblo Libre, Lima, Lima ","S/.6,900",4 dormitorios,3 baños,214 m²,1980.0,S/.200,Casa,Alquiler,25 ene. 2023 - Publicado por Inmobiliaria SAEG,https://www.properati.com.pe/detalle/14032-32-daf3-40d661bff042-2553fce6-ab78-437c,6900.0,214.0,4,3,PUEBLO LIBRE,9.15,9.15,9.991285678201566,8.24,9.3
Apartamento en alquiler en Ur. San Felipe,"Ur. San Felipe, Jesús María, Lima, Lima ","S/.2,800",3 dormitorios,3 baños,83 m²,2020.0,S/.265,Apartamento,Alquiler,"Hace 1 semana, 3 días - Publicado por REMAX UNITED",https://www.properati.com.pe/detalle/14032-32-5610-84a3ea723047-cd8c1d58-ac42-4d7a,2800.0,83.0,3,3,JESUS MARIA,8.64,8.64,9.990882448713773,9.239999999999998,9.3
Casa en alquiler en As. Miguel Grau,"As. Miguel Grau, San Bartolo, Lima, Lima ",USD450,3 dormitorios,1 baño,120 m²,2000.0,,Casa,Alquiler,6 mar. 2023 - Publicado por Alfredo Maccera,https://www.properati.com.pe/detalle/14032-32-bc71-c73c661fb498-c94357a0-8d71-120d,1665.0,120.0,3,1,SAN BARTOLO,9.9,9.9,9.99625,6.64,9.29
Casa en alquiler en Ur. Santa Monica,"Ur. Santa Monica, San Isidro, Lima, Lima ","USD5,000",4 dormitorios,5 baños,379 m²,1993.0,,Casa,Alquiler,17 feb. 2023 - Publicado por Top House Perú Inmobiliaria,https://www.properati.com.pe/detalle/14032-32-b5a5-784e30091bc4-6d6b3761-be85-4176,18500.0,379.0,4,5,SAN ISIDRO,8.86,8.86,9.986807387862797,8.76,9.29
Apartamento en alquiler en Ur. Confraternidad,"Ur. Confraternidad, Barranco, Lima, Lima ",USD950,2 dormitorios,3 baños,85 m²,2013.0,S/.450,Apartamento,Alquiler,27 feb. 2023 - Publicado por RENZO ACUÑA BENDEZÚ,https://www.properati.com.pe/detalle/14032-32-aa29-e9f2a37908b5-24e1ae20-8b1c-447d,3515.0,85.0,2,3,BARRANCO,9.17,9.17,9.988823529411764,8.06,9.28
Casa en alquiler en Ur. Javier Prado (Cahuache),"Ur. Javier Prado (Cahuache), San Borja, Lima, Lima ","USD1,900",7 dormitorios,4 baños,207 m²,1992.0,,Casa,Alquiler,4 feb. 2023 - Publicado por RE/MAX Gestión Inmobiliaria,https://www.properati.com.pe/detalle/14032-32-a911-bc122769111c-fae4a93-b6c7-435b,7030.0,207.0,7,4,SAN BORJA,8.86,8.86,9.990821256038648,8.719999999999999,9.28
Apartamento en alquiler en Ur. Parque San Martin,"Ur. Parque San Martin, Pueblo Libre, Lima, Lima ","S/.2,600",3 dormitorios,2 baños,85 m²,2015.0,,Apartamento,Alquiler,14 mar. 2023 - Publicado por Martha Vargas Serrano,https://www.properati.com.pe/detalle/14032-32-ea6-9ee0d71f8266-64caaaa1-9e8b-4690,2600.0,85.0,3,2,PUEBLO LIBRE,9.15,9.15,9.991732909379968,8.14,9.28
